{
  "version": "0.4.0",
  "status": "internal-preview",
  "groups": [
    {
      "id": "introduction",
      "labelKey": "groupIntroduction"
    },
    {
      "id": "foundations",
      "labelKey": "groupFoundations"
    },
    {
      "id": "identity",
      "labelKey": "groupIdentity"
    },
    {
      "id": "components",
      "labelKey": "groupComponents"
    },
    {
      "id": "patterns",
      "labelKey": "groupPatterns"
    },
    {
      "id": "experiences",
      "labelKey": "groupExperiences"
    },
    {
      "id": "governance",
      "labelKey": "groupGovernance"
    }
  ],
  "pages": [
    {
      "id": "introduction/overview",
      "group": "introduction",
      "slug": "overview",
      "title": "Visão geral",
      "summary": "O Sistema de Design organiza a identidade, as decisões e os componentes que ligam o Projeto Comunitário de Milreu, o Museu de Memórias e as futuras experiências digitais e físicas.",
      "status": "validated",
      "tags": [
        "introdução",
        "sistema",
        "milreu"
      ],
      "preview": "overview",
      "source": "Pacotes 05A e 05B",
      "platform": "Web · documentação",
      "sections": [
        {
          "id": "purpose",
          "title": "Finalidade",
          "body": [
            "Criar uma linguagem comum para o Portal, o Museu, a impressão, a base de conhecimento e a futura aplicação móvel.",
            "O guia não é apenas uma galeria visual: cada decisão deve possuir origem, estado, regras de utilização e histórico."
          ]
        },
        {
          "id": "principles",
          "title": "Princípios operacionais",
          "list": [
            "A comunidade ocupa a superfície; a instituição fornece moldura e rigor.",
            "A fonte visual primária é interpretada, não copiada.",
            "Leitura e acessibilidade corrigem limitações do suporte impresso.",
            "Tokens são a fonte técnica de verdade.",
            "Elementos em construção exibem maturidade explícita."
          ]
        },
        {
          "id": "scope",
          "title": "O que está coberto nesta versão",
          "body": [
            "A versão 0.3.0 documenta fundações e a estrutura do catálogo. Componentes e padrões especializados serão consolidados no Pacote 05D."
          ]
        }
      ]
    },
    {
      "id": "introduction/principles",
      "group": "introduction",
      "slug": "principles",
      "title": "Princípios",
      "summary": "Regras de alto nível que orientam as decisões visuais, editoriais, técnicas e comunitárias.",
      "status": "validated",
      "tags": [
        "princípios",
        "comunidade",
        "instituição"
      ],
      "preview": "rules",
      "source": "Pacotes 05A e 05B",
      "platform": "Web · documentação",
      "sections": [
        {
          "id": "community-first",
          "title": "Comunidade primeiro",
          "body": [
            "Fotografias, memórias e relações devem aparecer antes da explicação institucional. A interface não deve substituir a voz comunitária por uma narrativa académica dominante."
          ]
        },
        {
          "id": "evidence",
          "title": "Decisões rastreáveis",
          "body": [
            "Toda adaptação derivada do livro, dos dados do museu ou de uma necessidade de acessibilidade deve apontar para a sua fonte e para a decisão correspondente."
          ]
        },
        {
          "id": "living-system",
          "title": "Sistema vivo",
          "body": [
            "O sistema evolui por releases. Uma proposta não deve ser apresentada como solução aprovada apenas por estar visível no catálogo."
          ]
        }
      ]
    },
    {
      "id": "foundations/colors",
      "group": "foundations",
      "slug": "colors",
      "title": "Cores",
      "summary": "Paleta de produção com vermelho como assinatura, preto para destaques e superfícies claras para leitura extensa.",
      "status": "validated",
      "tags": [
        "cor",
        "vermelho",
        "preto",
        "contraste"
      ],
      "preview": "colors",
      "source": "Pacotes 05A e 05B",
      "platform": "Web · documentação",
      "sections": [
        {
          "id": "roles",
          "title": "Papéis semânticos",
          "body": [
            "O vermelho marca entradas, aberturas, transições e fechos. O preto aquecido serve para preenchimentos de destaque, código e momentos de contraste. Branco documental, canvas quente e linho suportam leitura prolongada."
          ]
        },
        {
          "id": "usage",
          "title": "Utilização",
          "rules": {
            "do": [
              "Aplicar vermelho em áreas breves e deliberadas.",
              "Usar superfícies claras em textos extensos.",
              "Validar contraste de texto e estados."
            ],
            "avoid": [
              "Transformar o vermelho em fundo contínuo do portal.",
              "Usar cor como único indicador de certeza.",
              "Extrair cores finais diretamente do scan do livro."
            ]
          }
        },
        {
          "id": "tokens",
          "title": "Tokens principais",
          "tokens": [
            [
              "--ml-surface-signature",
              "#A83227",
              "Assinatura e abertura"
            ],
            [
              "--ml-surface-inverse",
              "#1E1A17",
              "Destaque e preenchimento"
            ],
            [
              "--ml-surface-reading",
              "#FFFFFF",
              "Leitura"
            ],
            [
              "--ml-surface-canvas",
              "#FFFCF7",
              "Fundo geral"
            ],
            [
              "--ml-surface-muted",
              "#F7F1E7",
              "Agrupamento e apoio"
            ]
          ]
        }
      ]
    },
    {
      "id": "foundations/typography",
      "group": "foundations",
      "slug": "typography",
      "title": "Tipografia",
      "summary": "Três famílias por função: Fraunces para expressão, Spectral para leitura editorial e Archivo para interface.",
      "status": "validated",
      "tags": [
        "tipografia",
        "fraunces",
        "spectral",
        "archivo"
      ],
      "preview": "typography",
      "source": "Pacotes 05A e 05B",
      "platform": "Web · documentação",
      "sections": [
        {
          "id": "roles",
          "title": "Funções",
          "body": [
            "Fraunces cria aberturas e títulos com presença editorial. Spectral sustenta narrativas e textos longos. Archivo organiza navegação, filtros, metadados e tabelas."
          ]
        },
        {
          "id": "readability",
          "title": "Leitura digital",
          "list": [
            "Corpo principal mínimo de 18 px.",
            "Entrelinha recomendada de 1,65.",
            "Medida de leitura de 68ch.",
            "Evitar colunas estreitas e blocos densos herdados do livro."
          ]
        },
        {
          "id": "loading",
          "title": "Carregamento",
          "body": [
            "Nenhum ficheiro de fonte é distribuído nos pacotes. A implementação deve usar fontes licenciadas por serviço permitido ou fallbacks documentados."
          ]
        }
      ]
    },
    {
      "id": "foundations/spacing",
      "group": "foundations",
      "slug": "spacing",
      "title": "Espaçamento",
      "summary": "Escala comum para compor leitura, componentes, navegação e experiências imersivas.",
      "status": "validated",
      "tags": [
        "espaçamento",
        "escala",
        "layout"
      ],
      "preview": "spacing",
      "source": "Pacotes 05A e 05B",
      "platform": "Web · documentação",
      "sections": [
        {
          "id": "scale",
          "title": "Escala",
          "body": [
            "A escala base cresce a partir de 0,25rem e privilegia combinações previsíveis. Espaçamentos maiores são reservados a mudanças editoriais e aberturas."
          ]
        },
        {
          "id": "rules",
          "title": "Regras",
          "list": [
            "Use tokens; não introduza valores arbitrários sem decisão.",
            "A proximidade deve refletir relação semântica.",
            "Mudanças de secção exigem mais espaço do que mudanças internas."
          ]
        }
      ]
    },
    {
      "id": "foundations/grid",
      "group": "foundations",
      "slug": "grid",
      "title": "Grelha e breakpoints",
      "summary": "Grelhas responsivas de 4, 8 e 12 colunas adaptadas a conteúdo editorial e experiências visuais.",
      "status": "validated",
      "tags": [
        "grelha",
        "breakpoints",
        "responsivo"
      ],
      "preview": "grid",
      "source": "Pacotes 05A e 05B",
      "platform": "Web · documentação",
      "sections": [
        {
          "id": "systems",
          "title": "Sistemas",
          "body": [
            "Quatro colunas organizam telemóveis, oito colunas suportam tablets e doze colunas estruturam ecrãs amplos. A medida de leitura não deve crescer indefinidamente com o viewport."
          ]
        },
        {
          "id": "museum",
          "title": "Exceção imersiva",
          "body": [
            "O Museu pode ocupar o ecrã integralmente, mas legendas e detalhes continuam submetidos a medidas de leitura e zonas seguras."
          ]
        }
      ]
    },
    {
      "id": "foundations/shape",
      "group": "foundations",
      "slug": "shape",
      "title": "Forma, borda e elevação",
      "summary": "Formas discretas e funcionais que evitam uma aparência genérica de aplicação comercial.",
      "status": "in-review",
      "tags": [
        "forma",
        "borda",
        "raio",
        "elevação"
      ],
      "preview": "shape",
      "source": "Pacotes 05A e 05B",
      "platform": "Web · documentação",
      "sections": [
        {
          "id": "direction",
          "title": "Direção",